{
  "chunker_version": "bank-rag-v2-chunker-2.0.0",
  "total_input_provisions": 3341,
  "total_emitted_chunks": 1573,
  "total_anomalies": 32,
  "anomalies_by_type": {
    "REPEATED_HIERARCHY_LABEL": 14,
    "DIRECT_ARTICLE_POINT": 5,
    "EXACT_DUPLICATE_LEGAL_TEXT": 13
  },
  "context_mode": "metadata_only",
  "hard_limit": 4800,
  "max_emitted_characters": 2390
}